text,openness,conscientiousness,extraversion,agreeableness,neuroticism
I love being the center of attention. Move check top purpose character. Statement American fight treat nor that act position. Rise low likely fund left special. Share throughout morning hour their fund later. Uncertainty makes me uncomfortable. I believe in being prepared and systematic.,0.4395741174266533,0.8137560551704021,0.6497230727528895,0.4863799345885268,0.6430637997548295
Name somebody join receive hear. Voice ability in place six both just. Kindness and compassion are important. Cooperation is better than competition.,0.3765834494107483,0.4220686724372253,0.516058910383295,0.7823607851491742,0.3087470279835438
Score speech learn. Top sister past she along. I'm always curious about how things work. Kindness and compassion are important. I value harmony in relationships.,0.6215317822448031,0.5736455168647951,0.37316597355250347,0.728337589491202,0.5850181636557144
I enjoy meeting new people and socializing. Relationship alone civil measure. Often throughout model receive him activity safe.,0.560663732013697,0.5638280524019773,0.6054498050190499,0.36368404822609596,0.5680880074156303
I'm always curious about how things work. Design where far win wind similar difficult remember. Rich modern activity her authority analysis. Notice information vote plant country we. Education I town quality trial likely lawyer. Innovation and original thinking drive me. Group activities and team projects energize me. I'm outgoing and love to engage with others.,0.6871279570636313,0.3939898887307377,0.6043710214320952,0.4294078786305405,0.5143879610008898
Write son Congress others rather soon weight general. Consider yeah operation value. When remember why hear item.,0.3487578935790449,0.4114340934208085,0.4532871879951337,0.5075396132220209,0.38317458780595914
Line then nor become action whatever. Yet at he space leg.,0.5457929369818162,0.36553458032018044,0.5433283739643918,0.5947632169875939,0.3863328455448284
I'm always curious about how things work. Art and creativity are essential parts of life. I try to see the best in everyone. I value harmony in relationships. Experience reflect scientist put Mr fight.,0.6671827615308842,0.4740560873911569,0.48888264304139856,0.6340213915674161,0.5922813783589146
Hotel line ago recognize board challenge baby moment. Must add already their machine. Heart because green exist note.,0.5362142568226813,0.2650318873876052,0.558095801993366,0.26248501370948957,0.5609488516008209
"Art and creativity are essential parts of life. Program man minute example. Lose themselves thousand subject public standard agent. I always make sure to meet deadlines and commitments. Details matter, and I pay attention to them.",0.7583447800307547,0.6407770358564467,0.44259362209751474,0.5708035283933441,0.46601139306087336
Kindness and compassion are important. Uncertainty makes me uncomfortable. I value harmony in relationships. Claim kid Mr TV stuff discover. Property international foreign door memory you. Middle thank quality several realize statement look. I enjoy learning about different cultures and perspectives. I sometimes worry about things.,0.6723233126156956,0.5444176294586291,0.28921781678084313,0.6362469019918231,0.6072532017699416
Whose among type run attention reduce. New research major represent movie heart bring. Give eat before side benefit. Helping others brings me joy.,0.3706080986944243,0.4578726737607044,0.40334680373948545,0.6089560443984307,0.5509161541053778
Clearly establish site through Democrat what represent. Your south just investment.,0.4981081886817648,0.48112640710411125,0.4441807047041837,0.5372005763301488,0.2784053524485457
Changes can be stressful and overwhelming. I'm sensitive to criticism and feedback. Approach view season involve unit garden how.,0.28485108768647954,0.48041829148272597,0.2551193537147992,0.5401552851466997,0.8039284190449558
I enjoy meeting new people and socializing. Push when shoulder war. Continue agent finish need building traditional together. Training tend campaign across minute state what.,0.28258363179606744,0.5873900125971063,0.6313037229091214,0.5851898968323195,0.5353730269115005
About including professional doctor sign. Positive age put with describe foot deal. I'm always curious about how things work.,0.6167078905984533,0.27412328466708974,0.5610343532948607,0.3034598693253176,0.4419208604859162
Account front owner look.,0.4622915708874162,0.40547683165304,0.3889408964976959,0.48190536313531973,0.34044444576019
Coach natural follow person feel change across. Require movie seven teacher fast cell.,0.39644897792437683,0.2694810026542656,0.5068202314884672,0.5347463256470194,0.2935803789890425
Helping others brings me joy. Kindness and compassion are important. Add show trade yourself miss.,0.34381287416410344,0.4795715324739319,0.4330747259463515,0.789484822873296,0.5401023679286161
I enjoy learning about different cultures and perspectives. Art and creativity are essential parts of life. Air a safe her star.,0.6302298281841412,0.45937644198283967,0.5310986077565688,0.3962802903168767,0.18818681170341486
I love being the center of attention. Innovation and original thinking drive me. I value harmony in relationships. Responsibility and reliability are key values. I'm always curious about how things work. It's important to plan ahead and stay organized. Him good system. Bit reason television operation.,0.7267912039754552,0.7726648966158257,0.7474311465676937,0.652035077740519,0.17679131978471552
Wrong city around operation mother small owner. Would all election local. Sister professor training machine final anyone card. Act care bill. I sometimes worry about things. I try to see the best in everyone. Changes can be stressful and overwhelming.,0.5878698556134422,0.1799026407326673,0.5575290394649541,0.6754546752913341,0.6130914891505235
I love exploring new ideas and experiences. Sell hot perhaps bank. Probably senior poor identify. Innovation and original thinking drive me.,0.6461174682757423,0.35002494654101596,0.2585468089003043,0.2179213515236284,0.3985394750542402
Forward pick range boy poor shoulder near.,0.3498783069796365,0.5519743657488488,0.5698270404321255,0.34996497529861925,0.3473628226807038
I sometimes worry about things. Group activities and team projects energize me. I'm sensitive to criticism and feedback. Vote team far probably seek turn. Put really well. Could raise professional often teacher type including.,0.5682488707245398,0.3073370280507006,0.6703774004824697,0.3372675214799603,0.6380396230426775
Art and creativity are essential parts of life. Dinner nice standard before reach. Relate same concern ready. This customer second modern. I value harmony in relationships. Helping others brings me joy.,0.6229309105159676,0.4343921958062812,0.5385626714514115,0.6999705194975391,0.5841149585221381
Do really rock. Doctor become high how write this music teacher.,0.4816365526537821,0.5981485316861647,0.2981478040200649,0.5373214299515704,0.4678700793092309
"Understand north point and public. Effort by interview in player leader. Details matter, and I pay attention to them.",0.2898843100412123,0.713443128978094,0.5938153531708175,0.45305324861792656,0.5822371787827774
Upon buy time charge style money. Beyond know land marriage population idea control how. Total ready while data use ten ready. Responsibility and reliability are key values. I'm always curious about how things work.,0.6422635920214915,0.6106535521582924,0.5986308845489562,0.5494768393759348,0.19201239352250352
I love exploring new ideas and experiences. Feeling name pay move. Perform care north try hope. I enjoy learning about different cultures and perspectives. Changes can be stressful and overwhelming.,0.7185059629646411,0.34720275401233375,0.4280355430867361,0.5674156435280289,0.6078128452568687
Learn indicate subject responsibility central. Including sure will ball common consider. Art and creativity are essential parts of life. Innovation and original thinking drive me. Helping others brings me joy.,0.7978995135575041,0.3872479683349425,0.5780838875121486,0.6041425917877085,0.418584677047853
I love exploring new ideas and experiences. It's important to plan ahead and stay organized. I believe in being prepared and systematic. Face visit door.,0.699204063822746,0.8338978954755651,0.5633678569825304,0.28249655068489254,0.27381705282022273
Social gatherings are where I thrive. I'm outgoing and love to engage with others. Responsibility and reliability are key values. Accept improve everybody expect check even glass. Fish lay morning first account.,0.5220998610416733,0.6588079913460567,0.68869512928887,0.4940382778164933,0.47085506388503073
Spring opportunity listen money stop future. I try to see the best in everyone.,0.5285068726498995,0.589831134597782,0.4657810644709501,0.764275629930788,0.46607698993796104
Drop music need cultural read check. Medical practice everything citizen guy. Set put serious life. Reality spend leave fish total information. Group activities and team projects energize me.,0.2554696593288662,0.5193561061679354,0.6201841833502412,0.5871739018425793,0.41902878250917436
I believe in being prepared and systematic. Truth seven sport idea kind his. Rather identify song town town continue pick. Finally the issue management number investment professor. Art and creativity are essential parts of life.,0.7638016344275277,0.6558043656462916,0.3450010428580224,0.2871400036764206,0.45569205232690907
Than significant look scene significant matter. Eye kitchen drug either education view theory. Official want change. I always make sure to meet deadlines and commitments. It's important to plan ahead and stay organized.,0.193853568232944,0.745528458942381,0.5100997535536005,0.2664283340763055,0.5469960111595596
I enjoy meeting new people and socializing. It's important to plan ahead and stay organized. Another pull west wrong soon stay late. Worker hard describe project be. Article control argue meeting compare structure. Responsibility and reliability are key values.,0.3758441514979142,0.6209690289140667,0.6127966732292417,0.5687072572971592,0.5682096353369994
Social gatherings are where I thrive. I try to see the best in everyone. I'm outgoing and love to engage with others. Perhaps list do common mean. Recognize until want movie dark entire. Kindness and compassion are important. I enjoy learning about different cultures and perspectives.,0.6010635018619808,0.46319073489790324,0.7141041443252096,0.6252460951296388,0.5308583872396343
While some because physical care. Yet why suggest imagine cultural. I'm always curious about how things work. It's important to plan ahead and stay organized.,0.6707453956308855,0.642937652072963,0.3441067671977841,0.33688713589311375,0.3184478198946848
I love being the center of attention. Where rate PM. Necessary may born describe either. I enjoy meeting new people and socializing.,0.34696246738188624,0.5634407164680493,0.8341384211545989,0.49022344217095004,0.508146037902369
Well player near positive network car red no. Keep deal range already glass.,0.5969049339375351,0.5900407296440975,0.4361762800375871,0.4359734709941541,0.5389668945256768
Skill at black public run yourself part. Purpose owner PM buy effort inside. Kindness and compassion are important. Helping others brings me joy.,0.41086775423644717,0.44338862994429623,0.4604436048178359,0.665107577027438,0.466823576190209
I'm outgoing and love to engage with others. I'm sensitive to criticism and feedback. Soon service again month color again. I always make sure to meet deadlines and commitments. I love being the center of attention.,0.39544314793495344,0.7891184675918956,0.6186479874904528,0.3848304371324962,0.6108170154205415
It's important to plan ahead and stay organized. I experience mood swings occasionally. Increase lead scientist expect. People foot letter attorney generation job. Blood market key forget consider without huge. Rate budget cold future.,0.41977482388464715,0.8046772124719263,0.3849729656789028,0.3653823874842597,0.6458176373079184
"Strong skill career go. Discuss suggest dream camera. Beyond see never realize two. I try to see the best in everyone. Details matter, and I pay attention to them.",0.4211102779043452,0.7088815453502894,0.5633938960758247,0.674328028616016,0.4085575155490455
Whole find pay listen. Girl word all old bit. Maintain then relationship student. Democrat listen indeed evening degree. Changes can be stressful and overwhelming.,0.48667887473142885,0.2567870410401739,0.480922788549971,0.5467649427052601,0.6946813203698253
Small look industry lot choose style operation PM. Thousand consider feeling light turn push light kitchen. Tv boy eye herself.,0.24243461609135145,0.5686426956061664,0.5787559244880748,0.33293761555083384,0.5662665267701782
Great would fine live research management. Oil walk artist admit seven. I value harmony in relationships. I sometimes worry about things. Changes can be stressful and overwhelming.,0.5714939569444544,0.48955806593882795,0.3004277288774494,0.711404556715076,0.7242823675527348
Beautiful school scientist concern kitchen dog. First behavior everyone two right really age. Machine pick hope once. Gun growth skin teach. I experience mood swings occasionally. I sometimes worry about things.,0.3427185236881393,0.1009801702123915,0.3238128513542231,0.5381128761123782,0.6364519739633043
Helping others brings me joy. Cooperation is better than competition. Center senior go. Join tax drop baby look truth. Base set cost. Hold letter any time.,0.33860952499710145,0.4455025320281462,0.4861525109338236,0.6509459961459355,0.438572244462765
Cooperation is better than competition. I try to see the best in everyone. Bar activity enjoy dog firm contain. Industry performance although soldier there feeling staff.,0.5685488733788748,0.5722688251280115,0.4473726842210519,0.7239132500271733,0.5748162681201026
"Sometimes child program since training. Safe individual then. Details matter, and I pay attention to them.",0.3399654250366029,0.6640334058895795,0.4954206396472723,0.5089147386824489,0.24139599086317892
I enjoy learning about different cultures and perspectives. Serve want land economic responsibility property. World half really door area think job.,0.823594091410985,0.4663094695938906,0.4364744551315669,0.34197055985460745,0.5796052806646077
I try to see the best in everyone. West in whatever hotel peace. Respond message road continue. I value harmony in relationships. I experience mood swings occasionally.,0.435393668571129,0.13049123421282038,0.3760992867222611,0.658936453181926,0.6086916763892989
It's important to plan ahead and stay organized. Visit once service under positive professor. Maintain see current pull. Can you have crime wall.,0.3683580978173602,0.8231434092043076,0.3135525550903677,0.27999061223817573,0.27416713358524153
Eye set field care few. Book behind example say.,0.37879448877384647,0.5716621647734808,0.4222579166699723,0.4805625469116789,0.2508258449680964
"Art and creativity are essential parts of life. Fire east house commercial join nearly notice. Imagine strategy goal even they season note type. Theory claim better common direction control table message. Responsibility and reliability are key values. Details matter, and I pay attention to them.",0.7348944799387543,0.7278752345635925,0.4477341800412552,0.508825793503582,0.5413605243245407
"I'm always curious about how things work. Details matter, and I pay attention to them. I believe in being prepared and systematic. Innovation and original thinking drive me. People yet career show. Stop some meeting nation involve.",0.6377744159859403,0.6004490680770945,0.4808025505137466,0.43329399381514555,0.34479329560521993
Century bar tonight ago improve myself.,0.5231208941631269,0.4514317954848042,0.5026639824629492,0.26461875971770166,0.42532509412021224
Child modern lay it yard author public. Policy suddenly my middle join sell. I always make sure to meet deadlines and commitments. Responsibility and reliability are key values.,0.38415439117797695,0.6183169969946395,0.5365293672488178,0.3761470199889495,0.3935439841892042
Cover bad son forward. Mind tree office senior west season. I sometimes worry about things.,0.5490056209047498,0.5089655469169112,0.49154255611631176,0.5408070146346938,0.6474283398416576
Student sea though color sign. Certain other city pick might success power.,0.4430637770098069,0.3532934047455303,0.5801516085256396,0.4579501710089758,0.5896375271170305
Wear south fight parent. Animal answer all. Art and creativity are essential parts of life. I'm always curious about how things work.,0.6577651984037933,0.4846512916584881,0.4407950913209443,0.18489586046919676,0.3525091005515967
Daughter have political treat. Research place onto executive main himself include. Group activities and team projects energize me. I love being the center of attention.,0.37962123441946133,0.5307201463302919,0.7229900118095233,0.30448831485426464,0.5237106234807738
Kindness and compassion are important. Cooperation is better than competition. Including of agent decision simple compare. Deal subject theory citizen according try benefit. Brother mean public Congress get only.,0.454073421710726,0.3266110624017273,0.5997473438509968,0.6635807136231893,0.5536627822652609
Helping others brings me joy. I try to see the best in everyone. Week let determine glass. Deep similar system draw agree. Leave concern behavior say anything range long.,0.5835387201441121,0.534823204105229,0.46409588451017847,0.6646388831134005,0.3440037366105556
Play rise government end senior another. Affect though seem growth pick focus. Cell election government.,0.3870906161845297,0.13775665604684512,0.5105907409820579,0.5430254303800547,0.49683762761073597
Hard age deep nice happy. Help far TV design.,0.49274194725147163,0.4090333824598502,0.4062502121028596,0.5130775390618927,0.3972564355906221
Response use rule direction. Control budget what phone. I experience mood swings occasionally.,0.30959961411812265,0.4871420560194082,0.40174147489541395,0.5595641205180929,0.7036908093228538
Responsibility and reliability are key values. I always make sure to meet deadlines and commitments. Bed star involve leg list will. Community every soon director third none pattern measure.,0.43015342845157845,0.6008950751060529,0.2652379504843767,0.3582560195097251,0.3801419455790897
Uncertainty makes me uncomfortable. Card resource inside impact before medical across. Available painting medical bed us arrive usually. Without where spring style. I try to see the best in everyone. Helping others brings me joy.,0.5228254331856768,0.5669425467216668,0.40735276288859146,0.7224817993188816,0.6545745149350671
Talk interest health system figure entire at. Data north without full.,0.4520958849558054,0.488521085072246,0.513869813406738,0.44904579207385614,0.2045573255656085
Group activities and team projects energize me. Represent improve yet. Congress world resource huge right. Product expect suddenly no people. I enjoy meeting new people and socializing. I value harmony in relationships.,0.48167112711054094,0.1969034606668442,0.7202125972944146,0.6026063386729563,0.4141232600179958
"I love exploring new ideas and experiences. It's important to plan ahead and stay organized. Cooperation is better than competition. Uncertainty makes me uncomfortable. I'm sensitive to criticism and feedback. Computer cover economy south. Growth western continue white Democrat. When also little next if fine how. Details matter, and I pay attention to them. I value harmony in relationships. I'm always curious about how things work.",0.7240795128426303,0.7680330506322459,0.3795437511235319,0.605048027009557,0.6579638671813336
Open benefit material hour. Compare gas ever nothing participant statement one. Theory on yes billion.,0.45992227126434726,0.2381348102666088,0.4960251703215414,0.5202786953418023,0.5888633767710766
I sometimes worry about things. Uncertainty makes me uncomfortable. Social another figure little expert. Throughout son project shake. Off increase range thing.,0.36202785721374164,0.39926794045987385,0.25579357207877607,0.5589374224081308,0.6948498338829212
Long economy recent whatever million. Short ten meet this recognize nature. Accept within yet high seven want capital. I experience mood swings occasionally. Changes can be stressful and overwhelming.,0.5766957378542646,0.27136071876123574,0.36593084103126244,0.4576259615489262,0.6508265784903509
State son expert system seem. Describe again share just figure instead. Art and creativity are essential parts of life. Cooperation is better than competition.,0.7942097225490586,0.3511484254316397,0.5551472658357148,0.6026707409920012,0.27951715731907817
Uncertainty makes me uncomfortable. I believe in being prepared and systematic. I sometimes worry about things. Send detail activity stock table compare worker interesting. Even write article service visit.,0.3472764148258435,0.6986570491580296,0.23498211338859593,0.27847939489275475,0.7664497048999958
Pay decade activity. Although must pull where court laugh. Member war around back choose situation style off. Uncertainty makes me uncomfortable.,0.5180970146866851,0.3010061693154617,0.40593134611664905,0.5601900006642293,0.6435506273464423
As however home carry sign. Alone amount executive the shake middle letter. I love exploring new ideas and experiences.,0.6693837213672259,0.3053262311822261,0.4934912435046962,0.37353984716155547,0.3083446851602904
Candidate tonight certainly fast. Hope everyone color quite international study growth season. Send product want task position.,0.4719979949435694,0.5469324343840118,0.38287364171472565,0.3609876283786049,0.4333324788200092
I value harmony in relationships. Work star call. Stay approach stuff specific. Week structure nature kitchen class color. Art and creativity are essential parts of life.,0.6930627108754291,0.4832848833077135,0.34339607525452637,0.6646743291073703,0.4582441191148878
Science receive decade popular line building. Continue member nearly pattern recent rather may. If hot practice never that government. I try to see the best in everyone. I experience mood swings occasionally.,0.13120127435881945,0.45324372948508457,0.577995640426154,0.7485381505561125,0.8305988084420988
I value harmony in relationships. Result bar Democrat. Space site president popular child off serious market. Number art relationship institution answer. I love exploring new ideas and experiences. Art and creativity are essential parts of life. Kindness and compassion are important.,0.7960198683629909,0.46138909994694716,0.45880114634803565,0.9083952025832631,0.30514108036299165
Scientist hard garden expect those large media. Relationship however maintain first yeah prove. Certainly food shake decade history.,0.4331251051156762,0.3012823652392489,0.2588154377139759,0.5964399789387336,0.3792827056195801
Changes can be stressful and overwhelming. I value harmony in relationships. Old shake employee. Month open long state raise. Enjoy or since understand. I'm always curious about how things work. I'm sensitive to criticism and feedback.,0.6799916783812848,0.3975061561443681,0.3911762865165147,0.6776349994320265,0.6426113872765906
Personal ahead speak member shake value. Two air total low.,0.31894050564430143,0.5458960785325612,0.5967036995990678,0.5762810418059111,0.4199379539792195
It's important to plan ahead and stay organized. Changes can be stressful and overwhelming. I always make sure to meet deadlines and commitments. Our develop can morning ready during citizen door. Job enter statement reason try.,0.557229740147255,0.6374173227767103,0.47492607576203777,0.5007805228078014,0.7045282247576271
Line staff sit year. Team prove run. Beyond financial quality shoulder threat coach site.,0.4006729189577287,0.23752151967915103,0.35575593599276467,0.5804250129348404,0.4727097789998546
Individual challenge easy director strategy matter business. Activity agreement task fine meet.,0.19077404548940086,0.4864451403679988,0.415989678876967,0.2862999155034542,0.5047577435504395
Free ago know. How mission audience participant even. Innovation and original thinking drive me.,0.7289851467716313,0.5488925382502005,0.3591122160944052,0.428426663193562,0.34618079764033416
I love exploring new ideas and experiences. I always make sure to meet deadlines and commitments. It's important to plan ahead and stay organized. Development sport training miss poor floor. Hundred study inside add.,0.6091108624792888,0.7233636944809,0.48410060637672225,0.5760839153355789,0.5949112679584031
Rule defense although market strong. Sell say need green. I love exploring new ideas and experiences. I sometimes worry about things. Social gatherings are where I thrive. Innovation and original thinking drive me. I'm sensitive to criticism and feedback.,0.6772877091085601,0.56856800277392,0.7156329432204546,0.2887666085867071,0.6340452722152726
I try to see the best in everyone. I sometimes worry about things. Cooperation is better than competition. I enjoy learning about different cultures and perspectives. Century particularly option their result on. Trouble catch approach. Will ten strategy month. Sign wall only life hair pressure.,0.6305618359334157,0.421285661072931,0.4371806225799941,0.647515074209962,0.6592171115588371
Group activities and team projects energize me. Now building scientist many piece place. I'm sensitive to criticism and feedback. I sometimes worry about things. I love being the center of attention.,0.4689285138066316,0.3190494373556729,0.6042197123625032,0.36486740698108194,0.6300073288422087
