text,openness,conscientiousness,extraversion,agreeableness,neuroticism
I sometimes worry about things. Imagine must center yourself. Vote step base mission attack relationship necessary.,0.5710765439105722,0.4999980287933559,0.578952321712635,0.38537543232300786,0.7612598163129002
I sometimes worry about things. I always make sure to meet deadlines and commitments. Plant central your future responsibility great song wonder. End hold have employee process role outside. Design rest week hear opportunity present. Huge education near cold nature second notice.,0.3425690014233152,0.6721723251223352,0.4221070452686164,0.4616701018155533,0.6290832458437815
I'm always curious about how things work. Spend direction interest member. Poor season apply main event all factor. I love exploring new ideas and experiences.,0.7280276515852113,0.31479447304338304,0.5610522424737027,0.5221623830637462,0.3374891533725133
Nature three even about. General each create. Science product style strategy floor.,0.5817995872465502,0.3539936728059311,0.5100216894354413,0.43305998769426207,0.4642500053725458
We involve cell training type expert worry. Southern affect six leader fact south trip. Responsibility and reliability are key values.,0.4462815379954789,0.6171487161310982,0.3395228049269165,0.5453091261034223,0.43429007075728643
Cup wife street city drug foreign. Me off her reveal.,0.46058302909363424,0.5616653107459355,0.40774740141137145,0.4530567128392246,0.5038906648713685
Apply ten reality down base foreign attention. This these conference area phone exist.,0.36867737479572954,0.4360900873420793,0.5378215732178293,0.2609681963439763,0.2811658106423754
I'm outgoing and love to engage with others. Leave here trip after. Visit indeed president go once growth.,0.44353360486743787,0.5393945292432885,0.7890238141861243,0.44440692232517043,0.29901091863280255
Social gatherings are where I thrive. Perhaps lay he political at. She management wife ten.,0.24930896193252364,0.44188602939804433,0.7284254827656883,0.28100323893408413,0.4442968459407849
I value harmony in relationships. Interest process debate figure ok final agreement claim. Beat church recognize can trip. Group activities and team projects energize me. I try to see the best in everyone.,0.5244692136507435,0.39217203825950553,0.6184688177651962,0.6335167869193328,0.3030482902246939
I sometimes worry about things. Site run huge toward money. Protect situation whatever anyone indeed.,0.5573775951217498,0.5634381493839513,0.4526890617616879,0.3541015039925027,0.6686495854402112
I'm sensitive to criticism and feedback. Decision surface hour government name. Somebody bill book serve.,0.31924145261298115,0.3968002610666405,0.561029535158082,0.5935477160375531,0.6765380311131137
I believe in being prepared and systematic. It's important to plan ahead and stay organized. Teacher and structure center.,0.3751455143160903,0.6476910744067034,0.502905840182418,0.5001339480965069,0.23681158163837812
I enjoy meeting new people and socializing. I love being the center of attention. Exactly sometimes team worry project. Dinner then quickly skill carry total health. Respond appear form somebody his image.,0.5311250073031311,0.43308781613879355,0.8738835988569091,0.3334155416726244,0.34298302628327726
Data participant concern TV. Risk property month its government crime help. Past drive ok town community guess I.,0.5839275843236352,0.22985789553816377,0.41636247353753114,0.46230597192213824,0.5225985942739853
Mind town single each yes but rule camera. Painting begin present interesting week girl many. It's important to plan ahead and stay organized. Group activities and team projects energize me.,0.2599047688309294,0.6002028011751426,0.7073517695052194,0.4650560531117153,0.17305774165587504
"I'm sensitive to criticism and feedback. I love exploring new ideas and experiences. Changes can be stressful and overwhelming. Week federal miss action consider before economic. Responsibility its stop star. Details matter, and I pay attention to them. I believe in being prepared and systematic.",0.8056421487822866,0.7947527411292489,0.33196540999004864,0.5537977536357759,0.7845896552137295
Star whole especially yourself. Just pretty third generation ground court goal. He sort someone himself southern clearly. Responsibility and reliability are key values.,0.4178085669265586,0.6059671818041131,0.3417291266239581,0.5624158616486882,0.4652064403408349
Kindness and compassion are important. Beautiful enter southern compare plant check amount. Citizen shoulder speak report election.,0.48412597639417,0.5837583518547255,0.5012232561284012,0.6320112269338097,0.5516365313474286
I'm sensitive to criticism and feedback. Group activities and team projects energize me. Car protect while about. I'm outgoing and love to engage with others. Helping others brings me joy. Cooperation is better than competition.,0.22368997658693215,0.536803650315756,0.6085901416063131,0.6199545283770362,0.6126143374235652
Uncertainty makes me uncomfortable. Sometimes likely air activity. After read visit night.,0.5879901143019303,0.4177738755182359,0.4939710441362287,0.43732500196751556,0.6101218080709593
"Details matter, and I pay attention to them. Section player design involve. Professional training prove look he. I always make sure to meet deadlines and commitments.",0.5319832905007316,0.6354023372668494,0.44245755011103394,0.5240209912314654,0.44750029864329915
"Thing back against. Political dinner any keep really feel. Details matter, and I pay attention to them. I'm always curious about how things work. I always make sure to meet deadlines and commitments. Innovation and original thinking drive me.",0.7753302839001148,0.7812447775536714,0.2814173572064532,0.352380832406681,0.3391299883935047
Under to learn economic mean. Month his boy back development series world. I always make sure to meet deadlines and commitments.,0.1930880931843868,0.6741578898916973,0.1839034935242093,0.3594220123366988,0.49518940834974795
I value harmony in relationships. Woman relate he development would work you. Consider three respond explain throughout pretty responsibility. High too author executive whether education. Helping others brings me joy.,0.37960522236086874,0.4566134259376191,0.20583479051770961,0.6435214961915761,0.5272808411718869
"Responsibility and reliability are key values. Details matter, and I pay attention to them. Up fire PM statement. Time note trade. Helping others brings me joy.",0.42800353059245827,0.8027602784432772,0.39116911283793665,0.8007451130638917,0.2913127623721318
"Travel same water area new picture. Practice miss truth among fact. Executive herself plan. Changes can be stressful and overwhelming. Uncertainty makes me uncomfortable. Details matter, and I pay attention to them.",0.2476665408451268,0.6536519073825402,0.3913589318884194,0.5338010756469829,0.6158990042726378
Hour another animal local. Tell another father whatever daughter. Relate girl shake. I'm always curious about how things work.,0.6852715757512183,0.39168859089395736,0.5129021062296616,0.5057336197454099,0.20212639134674712
Same western available newspaper. Baby future teacher area professor somebody reveal. As specific that special. I always make sure to meet deadlines and commitments. Responsibility and reliability are key values.,0.5287069759539015,0.6031815638972188,0.5917019644148873,0.5578513973784074,0.5772462489222949
Helping others brings me joy. Address key without order. Statement either girl. Skin area live company fly significant person. I'm outgoing and love to engage with others. Kindness and compassion are important. I'm always curious about how things work.,0.6138209257241583,0.3932166092937043,0.7558437956414331,0.6381407477152442,0.43615110492642617
Cooperation is better than competition. I sometimes worry about things. Republican teacher money special all hand. Stuff tax history sell factor citizen dog. Lay seem brother attack.,0.4258149577853306,0.4568627898952932,0.5708017153906192,0.6576118691790073,0.7541257623297952
Test send begin gas different mother. Record other American it. We over organization same finally institution own.,0.43542247816317764,0.3610867138007691,0.3986359073417118,0.37392080873821615,0.5858031859146313
Heart president sport leave rich region much every. Imagine begin Mrs once.,0.43473369579256205,0.4174359989418678,0.44391466979287564,0.4075157042533458,0.3589662998393188
Movement star impact speak rock. I'm always curious about how things work.,0.726696522143129,0.37385192151741464,0.5814929173082449,0.38342358854636943,0.5518394201787414
Prove right blue take. Sign clear actually music need network. Innovation and original thinking drive me.,0.7543045168571175,0.3882567861262089,0.33733506649993067,0.47046039703648485,0.30521200063477727
Responsibility and reliability are key values. Price call than gas. History thank maintain ahead. Write cultural senior long us mean. I believe in being prepared and systematic. I'm outgoing and love to engage with others. I'm sensitive to criticism and feedback.,0.34389030325694403,0.8488377408382459,0.6215712902088891,0.3492156616691006,0.6701098917014969
Between finish among become area. Military drop protect similar task send create institution. Around audience star adult class resource everyone. Cooperation is better than competition.,0.3896599827464701,0.5623233610532327,0.47889108339199415,0.6322958320922248,0.5756644043946283
Rule account certain near present. Dog green fall new know.,0.4455492976361288,0.36675309845190895,0.3172534490421861,0.5676216252935712,0.2441101690577991
Help option price establish. Care allow organization religious religious wall reason.,0.48424679606932247,0.4869077062944523,0.4644807441071712,0.5246050645663831,0.3960116271777245
Enough air bill answer. Change three rise teach officer instead without.,0.31256562304018004,0.5549567873031864,0.4204145697026502,0.582186353323408,0.49830014633885406
I experience mood swings occasionally. I try to see the best in everyone. Town rest bar many. Campaign article debate many pay.,0.5574968441184456,0.42699510888321485,0.40343001679696255,0.7814530012217807,0.8070068990835246
Section again allow. Identify poor I thousand window. Specific enjoy recognize almost window capital doctor strong. I love exploring new ideas and experiences.,0.7233283700572213,0.5316778333464912,0.48240159680859757,0.26949697319455507,0.543510063218079
Send process southern occur start message attention. Cup value who help. Mrs seek she teacher environment woman. Cooperation is better than competition.,0.3838733235058664,0.28229025969241056,0.5237131062858109,0.8062756168448014,0.29102783541993743
Already senior miss within. Office cup market employee both water. Many might out year to three.,0.485263965059535,0.4391869016884008,0.5577014259298754,0.5898677939959726,0.39321687559753693
"Then figure prepare around total. Me capital act compare. Details matter, and I pay attention to them.",0.41865006710967373,0.6019880410474767,0.36650791581736447,0.3105151617921931,0.5258141543524597
I value harmony in relationships. Cooperation is better than competition. I love being the center of attention. Know establish nor think. First reflect audience everyone get measure subject.,0.47676035629074376,0.503201541949907,0.6552314911882116,0.6154069747357566,0.4736061040220821
Stage sure message standard finally. Approach fast nation use religious real cold.,0.4898169741904608,0.3367105436749861,0.25918019652585694,0.49212403882908234,0.5861445327507148
I believe in being prepared and systematic. I love exploring new ideas and experiences. Price whom among past world today wish. Responsibility training natural nice industry voice. I'm outgoing and love to engage with others. Art and creativity are essential parts of life. Social gatherings are where I thrive.,0.6695592088323965,0.6908243340568366,0.6917078284168358,0.5918671197991786,0.41042654446825927
Cooperation is better than competition. I always make sure to meet deadlines and commitments. It's important to plan ahead and stay organized. Cup growth behavior feel risk shoulder. Pay left establish degree politics able. Call course worker region them myself security.,0.4212387979716819,0.6153818046183048,0.5239605872593218,0.6295964039942913,0.5135291542305529
I try to see the best in everyone. Rule rate ago treat art hard situation. Speech commercial tax window voice herself member. Rate success society likely. Behind section get environment owner maintain worry.,0.47771324815883665,0.4976530249177871,0.4102717080549305,0.7372620766985877,0.4220025864708488
I enjoy meeting new people and socializing. Nation than paper something respond. Understand both step month artist red expect trouble. Sport clear base suddenly. Behavior energy although less language throw wait Republican.,0.5582370725420565,0.406371408892627,0.7277107586232752,0.2919606367443312,0.3643522288071613
Poor TV together assume. I love exploring new ideas and experiences.,0.6202236484076409,0.529004788865565,0.4124426077969264,0.590147137132827,0.4753133448014305
Already opportunity we my somebody behavior to key. Dark billion before attack idea night. Group activities and team projects energize me.,0.43167441465334894,0.43452290115103004,0.679356007434675,0.5949794477376509,0.5742675397659432
Represent draw drop. Either human remember dog. I value harmony in relationships. Kindness and compassion are important.,0.5068988240297209,0.48190836392378095,0.3823944993272273,0.6743720939239151,0.32544469820016875
I enjoy meeting new people and socializing. Social gatherings are where I thrive. Art and creativity are essential parts of life. Drop ahead cultural environmental far more. Off few rest security. Quite western begin social citizen. I'm sensitive to criticism and feedback. Uncertainty makes me uncomfortable.,0.7254122439267836,0.5230027494437641,0.681118779462322,0.4440082220169767,0.6904932472717025
Helping others brings me joy. I love being the center of attention. Changes can be stressful and overwhelming. I love exploring new ideas and experiences. Total other blood discussion management social board. Remember need real church purpose probably experience. I experience mood swings occasionally. Art and creativity are essential parts of life.,0.6103484165784456,0.4801703220918906,0.6153955592469398,0.6552381363437205,0.6630489581508555
Experience number the board responsibility half above seek. Hit half answer pull international degree. Kindness and compassion are important.,0.47026150026317687,0.30639282424269937,0.14822231777118863,0.6627369767082866,0.4948752666384451
Everyone drive kid service concern politics. Situation international office foreign.,0.38067740282605694,0.5322252729001709,0.54242191182565,0.5358779493083695,0.41762673226935737
Operation east special catch room nice whatever. People want religious by next. Name positive site focus former. I experience mood swings occasionally.,0.5920958491349052,0.331001303498539,0.43176507617201626,0.3493496422242557,0.6006192122219899
Write eight test approach build. Watch accept agree treat.,0.3856683135306662,0.27150569674924585,0.5443652974936523,0.5440425531842751,0.34060052216284464
Innovation and original thinking drive me. Yourself happen with series up low. Arrive more deal start benefit miss.,0.6341659504960727,0.4968600500698377,0.42418978665195023,0.18971005087846893,0.5887448183768792
Food today bag. Question question public thought. I'm sensitive to criticism and feedback. Changes can be stressful and overwhelming.,0.5324935113992202,0.5402784466406307,0.17302494834821705,0.5248716742121049,0.6262360291985801
Road stock child mother force attack behind.,0.5443146917689671,0.5404653707907128,0.4902188084028333,0.4966288497019217,0.5965967690271946
Wall loss people purpose sound only. Service quite note attack fly myself. Interesting environment much child four.,0.5354105053943293,0.4161522618505062,0.39308902791478867,0.3358737768461352,0.36844622300733093
Number catch year cultural peace change. Personal hear manage.,0.4449489324606515,0.5983023458019086,0.3262490014088052,0.3777037892222203,0.4576619535342407
Changes can be stressful and overwhelming. Make participant research identify year become nation. Nothing information light sense chair. I'm sensitive to criticism and feedback.,0.3649045137982618,0.37318452504406335,0.4249212991257723,0.38012379072976227,0.6589694420238472
I sometimes worry about things. Difficult player company finally never. Many situation walk single send maintain.,0.342380807382035,0.47283562820986696,0.20382377297789905,0.5028139389170989,0.638697524796967
Against note sport large on activity far dark. Recently political doctor central. I enjoy meeting new people and socializing.,0.18855647705816242,0.4795311291917173,0.6220991867805701,0.5899407512037215,0.2773626701076989
I'm sensitive to criticism and feedback. My its anyone process growth. Changes can be stressful and overwhelming.,0.41597397102603195,0.46152200426832307,0.5386432065117508,0.5238239652787978,0.6264446112757664
Situation lose decision deal tough number catch. Task five audience ahead why science day. Resource billion purpose community. I experience mood swings occasionally. I try to see the best in everyone. Art and creativity are essential parts of life. I enjoy learning about different cultures and perspectives. I value harmony in relationships.,0.6423212738078676,0.5782542028956331,0.45029236060324057,0.7195474471665103,0.6405822344358304
Wait sister data develop team bank happen. Color yet foot security owner song remember phone. Behind beat seem. I value harmony in relationships. I'm sensitive to criticism and feedback.,0.5412739506140309,0.5500856533809904,0.42185695414808855,0.6044334445094323,0.722038436823648
Future democratic fire just. Enough church structure design poor. Activity piece party per authority.,0.37130831825945504,0.38089297587960025,0.5693800141659626,0.3727524250402883,0.48501264075452055
Group activities and team projects energize me. I love being the center of attention. Prove idea evidence size minute bar.,0.4893983411346223,0.40688988077073607,0.7460113897012983,0.33963528075641264,0.49432162361616977
I sometimes worry about things. Responsibility and reliability are key values. Throw explain else. Scientist animal matter little key too establish. I'm sensitive to criticism and feedback. It's important to plan ahead and stay organized.,0.3875298728899676,0.6901769276895959,0.57679479705163,0.5129227134188318,0.7188492700069868
Staff national sister. Under job page series. Seven manager piece suggest.,0.45824173040308974,0.5566168895236455,0.40492244751115075,0.5018458441727957,0.5870337597303596
Not travel station and collection energy recent most. Data military support ability commercial available everyone wish. Step develop piece record front amount.,0.4055941284371296,0.471547317270107,0.5513176096874216,0.38439372800211397,0.5905088873797745
Kindness and compassion are important. Imagine hair give chair west school. Since material according born civil guess. Long left reflect adult. Economic cause serve speech.,0.5568252279181303,0.4613492014773577,0.5179961439128736,0.7668981072359633,0.35325852436626554
Changes can be stressful and overwhelming. It's important to plan ahead and stay organized. Condition sign behind up. Above picture consider same item key tell. Research major heavy produce natural.,0.47711866178569373,0.7776480243107817,0.39167975744945954,0.43439544716179124,0.6416657938404426
I sometimes worry about things. Cooperation is better than competition. I value harmony in relationships. Record born station high remain fact. Campaign writer thus each most safe above. Changes can be stressful and overwhelming.,0.5567115327942922,0.5362794168586583,0.31575422555525634,0.6302478602562166,0.7606777548542457
Voice notice fast civil instead. Address network method enter nature thus. I always make sure to meet deadlines and commitments.,0.4753945252510815,0.6311317920114946,0.43576704139245176,0.44724992361143645,0.3170757987245013
Cooperation is better than competition. Fine measure adult major serious technology seek pattern. Address center rather whom few score. Through receive activity class past. Responsibility and reliability are key values. I believe in being prepared and systematic.,0.5469719320255743,0.6902813449141495,0.49130119136159645,0.6266056508295593,0.44180016477526707
So example sense street adult year hotel.,0.5987380622359069,0.5278146987227178,0.2727948788919813,0.3763745586286854,0.4490627002471056
Think model report moment woman where and organization. Example plant table international. Past pick clearly everything town home national.,0.4772551937266487,0.5596129965448818,0.2995661240448736,0.30104432789288865,0.4751215190830402
Art and creativity are essential parts of life. Federal decision computer allow. Thousand require reason minute. Key trip only determine religious charge.,0.6643215866888154,0.5587857417589429,0.3705664950812144,0.2478996770572944,0.41800288191603563
"Helping others brings me joy. Details matter, and I pay attention to them. I always make sure to meet deadlines and commitments. Education reason paper another job. Read major pay four contain TV. Letter each religious free conference single.",0.5226953583323669,0.6743313298127019,0.28528851261799215,0.6341476150605353,0.4635996401354743
Last call school several word. Political manager upon form. Fill single actually. I value harmony in relationships. Art and creativity are essential parts of life. I try to see the best in everyone.,0.6901853998409402,0.5884942887864844,0.5911975472027271,0.6609093128629613,0.423662563283553
I love being the center of attention. I try to see the best in everyone. Innovation and original thinking drive me. I enjoy meeting new people and socializing. Kindness and compassion are important. Budget start way low stay.,0.7298523587847912,0.4868795950055321,0.612814384858098,0.7029830706791953,0.22331605258289114
Art and creativity are essential parts of life. I sometimes worry about things. I enjoy learning about different cultures and perspectives. Source energy find person open. Effect last international hit his.,0.6402114348831495,0.3247357483570509,0.25423356435513783,0.4391641012312323,0.7345454073364782
Changes can be stressful and overwhelming. It's important to plan ahead and stay organized. Remember Mrs receive so conference image offer garden. Investment behavior ten away respond. Fear Democrat economy father. Responsibility and reliability are key values. I experience mood swings occasionally.,0.46862302048808424,0.6380404499551011,0.5027297512618227,0.38783364408802373,0.7819959263932036
Lose treatment man leg life college my. Ground right now likely onto soldier. Green hard politics sing guy. Responsibility and reliability are key values.,0.5872901277781255,0.7422091603053195,0.3538156051695761,0.29863509405794075,0.5852517420762791
Stand heavy build soon agent. Material until since card without southern.,0.5276661750952186,0.4869611329513565,0.5908864208056379,0.451120568823928,0.36507052448314964
Key strategy audience rule at. Even weight program technology kid. Helping others brings me joy. I'm sensitive to criticism and feedback. I experience mood swings occasionally. Kindness and compassion are important.,0.34005159166883325,0.5199484897169696,0.35095601142040717,0.665934694620739,0.603362209171353
I enjoy learning about different cultures and perspectives. Spend challenge pattern build eat under little assume. Pass product either man important six. Television visit top foreign can put sea. Responsibility and reliability are key values. I always make sure to meet deadlines and commitments. Innovation and original thinking drive me.,0.6236595898017918,0.691000672190237,0.5742735040444739,0.4159036248511756,0.31946367599180336
Month feel rise weight piece quite pick eat. Baby land good least dog between.,0.5084513183274648,0.338885413322462,0.35888216067952694,0.3253872028952474,0.3766479795126384
Current seat guess sometimes garden. Represent hit head. Special strong both really. I'm outgoing and love to engage with others. Kindness and compassion are important. Helping others brings me joy.,0.5638413475607232,0.3826674324674085,0.6479866644618926,0.6359655149494002,0.530688008676855
Mind card success occur. Together help especially power change either politics wait. Minute society seek else.,0.5679641202575193,0.47096933348267606,0.5479823168393421,0.2483841643065692,0.5623391832027406
I'm always curious about how things work. Front physical else voice style response. Involve benefit stay capital old pay wife. I enjoy learning about different cultures and perspectives.,0.745894143241595,0.45720906640208814,0.5366671508568254,0.4516866265982194,0.3834242210976471
Art and creativity are essential parts of life. Innovation and original thinking drive me. Debate cell free save crime. Wait build start think class air Republican. I enjoy meeting new people and socializing.,0.6293382181107596,0.44610014540827153,0.6272256701582332,0.5129318380944782,0.2824326040984386
That find necessary light professor company guy. Discover arrive floor may property others business.,0.358077828822996,0.5336318509816541,0.5019539359330908,0.4274563409055318,0.5076095939745454
Boy gun entire good crime. Something within gun build than now.,0.38640174988464454,0.3608578823115384,0.549115389314198,0.1281120009727499,0.413638090548635
Health reveal high then administration cause play. Second bill story push voice fine. I'm outgoing and love to engage with others. I always make sure to meet deadlines and commitments. Group activities and team projects energize me.,0.528046991988671,0.7081754971071982,0.7209747606631131,0.33695089591848865,0.5788967569187199
