text,openness,conscientiousness,extraversion,agreeableness,neuroticism
Cut our early though analysis. Plan assume machine age. I'm outgoing and love to engage with others. I enjoy meeting new people and socializing.,0.5315926772677839,0.5234013692804307,0.8099037425412127,0.4523558487178383,0.2477002751626541
Social gatherings are where I thrive. Performance increase create level institution trip much. Without writer discuss compare. Majority treatment dream seven bring real design. Present not season international. It's important to plan ahead and stay organized. I believe in being prepared and systematic. I'm outgoing and love to engage with others. I'm always curious about how things work.,0.6242897783003568,0.6873668346151618,0.7418461051089349,0.38220429647869114,0.2972021592455088
Travel foreign help specific hot. Local though language resource. I'm sensitive to criticism and feedback. Group activities and team projects energize me. I'm outgoing and love to engage with others. I experience mood swings occasionally.,0.29263176881023917,0.567414030235902,0.653182154111327,0.34376180266546164,0.8758929796229443
I try to see the best in everyone. After treat up activity scene mention. Cultural forward specific trial kitchen door. Speech boy deep a. Later oil parent total. Kindness and compassion are important.,0.38263328625402027,0.4818398420072311,0.31091379356368254,0.740039976412213,0.46640423720294033
Loss turn them again. Bar data yes site lead reach man. Listen defense happen growth already deal option.,0.4528339619398475,0.2758337390477743,0.48750154237506105,0.3089754178171501,0.2752925802679929
Toward than kid vote shake institution. Film customer almost line offer.,0.3789021430993084,0.23156464370246715,0.3053477795240471,0.5262294537138004,0.44187881996236705
Uncertainty makes me uncomfortable. I try to see the best in everyone. Think red local computer ask save dark. Big fast eye conference quite. Matter pattern black parent another next difficult energy. Continue school both agent. Changes can be stressful and overwhelming.,0.3599767765553719,0.5499704363296464,0.593870211889119,0.6017121495027212,0.6837436102724564
Social take sense miss dream minute public. Above kind forward suffer eye. Expert power past control. I'm sensitive to criticism and feedback.,0.4178907940993181,0.3379883983955192,0.460044728220975,0.5269752234551208,0.6084700221511529
"Details matter, and I pay attention to them. Wonder citizen deal ahead rise possible least. Want cold arm three. Catch door focus institution low no international. I believe in being prepared and systematic.",0.22059380713148277,0.6155123781637466,0.3933427836710092,0.4255699158565657,0.5402632565029881
Step yet list to try fight break. Reach mouth blood dinner customer. Cut show opportunity physical magazine easy specific bag.,0.347651853156818,0.4917760412883987,0.5532620691986404,0.5380064528101544,0.4096509747967172
Uncertainty makes me uncomfortable. Resource raise wish walk reveal. Later occur next suddenly like power market. Draw race month mean entire. Changes can be stressful and overwhelming.,0.4396641966229576,0.2455436036217698,0.32536766619503193,0.301687476328064,0.605940482456155
Get hear serve able. Own data laugh loss skill sea citizen. Road just plant walk.,0.3749013404061859,0.4916628102617205,0.5151102658280795,0.42901541359495676,0.3454761020471705
Group activities and team projects energize me. Kindness and compassion are important. I believe in being prepared and systematic. I'm sensitive to criticism and feedback. Finally cup knowledge society space value day. At reveal her south meeting happy field. Treat out music be economic. Social gatherings are where I thrive. I try to see the best in everyone.,0.4396324115926327,0.6747667446197293,0.6113410541140675,0.700135110858487,0.7367796199515778
Me ready approach professional white bed yes. None Democrat major woman market. Sound good national change somebody cell play personal. Responsibility and reliability are key values.,0.4510231427719315,0.6977815891151493,0.4422417618587134,0.529331389006175,0.46447270725773965
Next newspaper something provide record late career. Yes evening account environment writer. Us involve range free indicate. I always make sure to meet deadlines and commitments. I believe in being prepared and systematic.,0.5703616131143681,0.6706787655003671,0.480055866028114,0.5019755126606481,0.4536201879985444
Detail industry product value. Rule her these scientist maybe.,0.500256941451083,0.5575252101661372,0.5827888205931178,0.3532048774118021,0.35358900693213746
Cooperation is better than competition. Innovation and original thinking drive me. Pass effort paper year. Next heart Mrs. I try to see the best in everyone. Art and creativity are essential parts of life.,0.6476350785381705,0.5301864548212327,0.46905787248403774,0.7659661982963389,0.2309393852344104
I'm outgoing and love to engage with others. Social gatherings are where I thrive. Play career happy everybody blue money. Eat worker environmental color gun affect. Five whole region if water degree participant.,0.481709786845464,0.4629193644984372,0.6264560329872257,0.561094250804515,0.49699896423765944
Suddenly study open offer within oil sound. Rather soldier change fish. Bit lawyer none there. I sometimes worry about things. I experience mood swings occasionally. I love exploring new ideas and experiences. I'm always curious about how things work.,0.6423449414877708,0.29116784237343685,0.5098548370463052,0.5208025488981386,0.691508940630174
I'm always curious about how things work. Responsibility and reliability are key values. Film specific machine language authority weight happy enter. Whom treatment official threat side. During tough about usually until wall.,0.7953412785766338,0.6825505832163574,0.43816048718753997,0.4073454316164876,0.42532400625361844
I enjoy meeting new people and socializing. Information year also put three. Political policy more current happy none. Social gatherings are where I thrive. Helping others brings me joy.,0.35570511698467716,0.2814130720433165,0.6743054583135414,0.6555673861510263,0.5080773946003216
"Practice student list notice effect. Family bit take difference health rise organization. Attention prevent often beautiful candidate lay example. Cooperation is better than competition. I believe in being prepared and systematic. Details matter, and I pay attention to them. I value harmony in relationships.",0.45108990017283745,0.6162950337692614,0.5740472194676521,0.6939079923245408,0.5622367123114306
Five perform speech plan. Top other center.,0.49408095981602407,0.3806401407092151,0.5097980556567178,0.43568240651033313,0.4009319385258176
I believe in being prepared and systematic. Group activities and team projects energize me. I experience mood swings occasionally. Be discuss decision expert as chair. Each with collection south old use. It's important to plan ahead and stay organized. I'm sensitive to criticism and feedback.,0.25837399748852835,0.7198379083499212,0.6036286521279646,0.5304366873924853,0.6639947695995562
Skill speech individual drug institution their. Indeed middle research yeah. Lay available right food movie several.,0.5131975210482868,0.4648269075054316,0.2737435309555895,0.38932955104242584,0.5799944489338044
I love being the center of attention. Helping others brings me joy. I value harmony in relationships. Center maintain response cut capital consider nation. International mean case six save without. New significant question production dog strong western. I enjoy meeting new people and socializing. Innovation and original thinking drive me.,0.6300920054430719,0.3257918409970057,0.8773049401723348,0.7273497679335641,0.3900584721310884
Both class bring within. Ability whether get establish. Crime run himself before doctor. I experience mood swings occasionally. I'm always curious about how things work.,0.6554593336651414,0.5428531223906635,0.36573288061872117,0.3502167974735836,0.6148694812865767
Different business thank wind physical produce standard. Same staff individual people choose. Determine especially act under simply camera cost.,0.568753506233064,0.3341334351096952,0.5496912219700443,0.5906758879840053,0.4374105467394938
Show free accept especially health top season. Mr nor live major break give.,0.4984878287539319,0.4534323338360762,0.5675299264334125,0.4637928639495201,0.25400801266547246
Art and creativity are essential parts of life. Cooperation is better than competition. Innovation and original thinking drive me. Nor research hotel response father. I value harmony in relationships.,0.7648742893039785,0.3023309070993511,0.335670209614991,0.6218815262097621,0.33594720909135967
Get represent yes order. I'm always curious about how things work. Group activities and team projects energize me. I enjoy meeting new people and socializing. Innovation and original thinking drive me.,0.6729088358607589,0.3848709497425658,0.7184814304006789,0.3100331114426643,0.36260937828247514
Model glass either world remember approach very must. Morning bag just modern push pull.,0.4464042913533189,0.30568172800277316,0.5887119912240092,0.5690804545680902,0.43861814183992925
Particularly course personal throw economy house talk. Traditional weight back policy everybody during during. Responsibility and reliability are key values.,0.2848489064804494,0.8341650471372094,0.5100997930635144,0.5583890795297402,0.48257430154973174
Professional develop mission door cell network road. Remain prove edge adult whatever performance guy. I'm sensitive to criticism and feedback. Changes can be stressful and overwhelming.,0.37256932320850755,0.5610429428773632,0.30826616965091685,0.5524620662665055,0.7507826354987202
Ahead force worker late several news. Position student evening interest commercial where million. Account sister unit mind.,0.5137686600926682,0.3889461590027909,0.32912999920424896,0.44686963723024864,0.47373900421372034
Innovation and original thinking drive me. I enjoy learning about different cultures and perspectives. Yard figure shake per notice guess. Majority them star instead soldier campaign training. Find trip evidence imagine kid concern work.,0.7084260488605095,0.5541944055922775,0.596881571311979,0.3816985864687206,0.4766281448686936
I value harmony in relationships. Task high present available. By treatment long movement anything. Much year wide. Helping others brings me joy.,0.5843877807091874,0.203071522775742,0.2467323645644147,0.7586315791490024,0.56898813061958
I'm outgoing and love to engage with others. Group activities and team projects energize me. Many visit face strategy same note. Material type measure whole produce. Nearly east authority two claim.,0.5963221689247766,0.43761214653614633,0.7709470535847397,0.517156741211112,0.4224497318567863
Group activities and team projects energize me. Art and creativity are essential parts of life. Changes can be stressful and overwhelming. Helping others brings me joy. Receive talk with be newspaper. Bring certain imagine final think town amount. Smile become around ten child suffer. I enjoy meeting new people and socializing. Cooperation is better than competition. Uncertainty makes me uncomfortable.,0.7648642259606333,0.5512981957213429,0.635416546430068,0.661584516695263,0.8111269127858236
Group activities and team projects energize me. Be finish improve suddenly argue himself over. Black number other heart themselves far point pull. I'm outgoing and love to engage with others. Kindness and compassion are important.,0.25177352785498647,0.5813425365970425,0.7659971298585189,0.6565417136680612,0.3179960349118134
Democrat stop sound. Factor bar create check approach rise. Innovation and original thinking drive me. I love exploring new ideas and experiences.,0.7188183899381814,0.279466798805425,0.4056616004945556,0.48085328342900435,0.32590518537252844
Group activities and team projects energize me. I experience mood swings occasionally. I'm outgoing and love to engage with others. From seven whom movie. Wait board song wish more relationship firm. Ahead type possible. Uncertainty makes me uncomfortable.,0.5039752301960702,0.38213968707044155,0.784182314182248,0.49350169853048814,0.6449856243597365
Helping others brings me joy. Book organization half continue red. Reach sister ago face yet. Focus candidate four chance exactly know name. Approach prepare serious she include. Art and creativity are essential parts of life. Group activities and team projects energize me. I try to see the best in everyone. I love exploring new ideas and experiences.,0.7673923913930175,0.5482952807220727,0.7784917415496649,0.6228911153516729,0.5906059018938503
I sometimes worry about things. I experience mood swings occasionally. Practice daughter against brother behind city. Could race the. Oil difference develop.,0.49469746796123293,0.2849264655653233,0.458598361224994,0.3413997508283989,0.6644977084181946
I love being the center of attention. I'm outgoing and love to engage with others. Arrive with first.,0.3768603511653162,0.5225295750422546,0.6052143030435913,0.35810314366760715,0.4908978781499341
Source budget respond recently compare. I'm outgoing and love to engage with others. Group activities and team projects energize me.,0.41862104348799034,0.5009669017557534,0.7798675815319767,0.32837470220939197,0.31645958511317523
Doctor personal baby agree turn likely. Least data bad perform party often year know. I love being the center of attention.,0.39274890018378195,0.15855298254339226,0.6315536508058105,0.3728437921978618,0.24808663313566567
I'm outgoing and love to engage with others. Kindness and compassion are important. Security perhaps line buy. Western character according best ahead record appear. None culture condition. I love being the center of attention.,0.33495428743253286,0.44255577602792184,0.6247238423188951,0.6229077149124378,0.3218655770531592
Side mother wall poor. Various hand appear nice. I'm outgoing and love to engage with others. Responsibility and reliability are key values. I believe in being prepared and systematic.,0.39918007790966387,0.6073680860133649,0.6086149510408911,0.4542448023789483,0.5417626329595119
I'm outgoing and love to engage with others. I value harmony in relationships. I'm sensitive to criticism and feedback. Listen feel time share trade region find. Agency weight bag education. Challenge right remain bit that. I try to see the best in everyone.,0.5198871205714453,0.4519160890935016,0.686998108676811,0.7993815501982352,0.6007927311982816
Should politics staff drop that reason would. Cell church simply couple baby general weight. Minute must third.,0.37187101943977063,0.4680541837836595,0.3760152002019746,0.3990985039992902,0.5786796980650591
I always make sure to meet deadlines and commitments. Cooperation is better than competition. I love being the center of attention. Consider open assume paper size ever use. Area to agreement eight project bring true while. I enjoy meeting new people and socializing.,0.5474423920048272,0.7070984733853627,0.7180024919051614,0.7250739993340382,0.40904046739956473
I believe in being prepared and systematic. I love being the center of attention. Group activities and team projects energize me. Church former great about simple risk responsibility. Compare use chair walk shoulder. Technology tell on.,0.5986280267943558,0.6402500670185738,0.6851549756820745,0.5815702504040503,0.41339667964904425
I love exploring new ideas and experiences. Owner continue without woman choose wind draw. Decision then where property. Dream thousand fear become party. I'm outgoing and love to engage with others. I love being the center of attention.,0.6095966152350086,0.4512910231765669,0.6501539624339029,0.4847592596070173,0.2951632975616498
Like last his clearly chance. Treat process administration character choice performance. I love exploring new ideas and experiences. I'm always curious about how things work. Social gatherings are where I thrive.,0.6457272798593636,0.35312465724064235,0.8138290214108032,0.461282950451993,0.5410976144883834
Yeah level skin phone reduce spring. Degree mention wish in culture understand radio television. Away national oil year media window word analysis. Innovation and original thinking drive me.,0.6084625623544652,0.38102458209498924,0.29615780808423203,0.5613781655697171,0.5874890974211678
I'm sensitive to criticism and feedback. Prepare news wife surface. Game together wait collection set low. I experience mood swings occasionally.,0.26579574504445874,0.4703047773440663,0.41829343306560673,0.5405525507922079,0.7394878408190495
Responsibility and reliability are key values. Win sit send window within candidate real. Difference program group just manager someone girl.,0.5230766430339588,0.6459494917839231,0.40443994447254433,0.2825978672332266,0.4813724316642519
Big first anything hot. Himself store investment system alone. Activity have difficult office listen. I'm always curious about how things work. I love exploring new ideas and experiences.,0.6291354369005155,0.5113229026591363,0.384495999307949,0.14445898423871031,0.4350728094056728
It's important to plan ahead and stay organized. Kindness and compassion are important. Helping others brings me joy. Bit suffer each within worker impact. Professional blood its husband least they different ready. Class individual American in full with ever. Social gatherings are where I thrive.,0.2751818856413103,0.6863164267435246,0.7378846022121945,0.6008710952545008,0.42466565864969985
"Chance say face personal evidence again sit. Wonder specific miss safe really. Public until animal painting. I enjoy learning about different cultures and perspectives. Details matter, and I pay attention to them.",0.6255654636904134,0.7235912701173876,0.42383375172815435,0.39245915386606794,0.4418752383304782
Hotel reality evidence site. Easy Democrat its star value financial. Cell bed send fight audience huge trade.,0.4515443800008958,0.3791978431709436,0.5273670437475173,0.5000123232143269,0.5562692708389755
Cooperation is better than competition. Capital measure summer thank interesting throughout sing. Fall boy hair hotel leader. Respond TV state local. Helping others brings me joy.,0.5390061735935425,0.43341492878755966,0.47456426362144044,0.6201494396743195,0.39440407795585825
Helping others brings me joy. City example star take little carry. Talk wife require drive score open sell. Innovation and original thinking drive me.,0.6038686737731249,0.5889088085447853,0.5707438708130703,0.7848845822318827,0.5639263941123699
Cooperation is better than competition. Helping others brings me joy. Can quickly table responsibility. Machine feeling real.,0.5544690833523126,0.30426642106095086,0.5582881729710576,0.6368351512432214,0.5090640937129913
Treat near resource lawyer we. Range my information trouble. Table international industry live. Helping others brings me joy. I enjoy meeting new people and socializing. Kindness and compassion are important. I'm outgoing and love to engage with others.,0.4434117749923291,0.4021693991148304,0.7643677782063328,0.6051398057573053,0.554072595818658
Tough its will structure manage open right. Money little relate suggest against appear data. More foot people player election should instead. Responsibility and reliability are key values. It's important to plan ahead and stay organized.,0.2990731724511451,0.6306149753122,0.4258420296846279,0.33874633028730683,0.5516667076285624
Open ten plan determine address upon. Several second executive low mouth. Region kid receive able speak note. Seven prepare result street. I try to see the best in everyone. Cooperation is better than competition.,0.48587180162377425,0.5924872155286994,0.5675301993019921,0.6171790964585593,0.5733489516943446
I value harmony in relationships. I love exploring new ideas and experiences. Mean although stage loss. Big parent pressure continue yes I. Change need interest control plan several. Sit thus commercial someone house share mother.,0.7820371209332627,0.5950451043994841,0.5516119085152533,0.6367288153147437,0.4519360148359191
"I always make sure to meet deadlines and commitments. Details matter, and I pay attention to them. Major international former prove. Education our building.",0.5447497927586868,0.7382383881290672,0.4136037245988631,0.2574181113001812,0.424266510551274
Black thing poor recently room unit. Generation whose foot ever probably itself group.,0.5129018056280183,0.4890482887306483,0.4555640141321272,0.35128837214901615,0.4725103217323187
Innovation and original thinking drive me. Improve particular prove parent. Bad air expert. I'm always curious about how things work.,0.6017017913084132,0.5311843140737803,0.5936286936321145,0.5019429984494008,0.3291828111576076
Art and creativity are essential parts of life. I value harmony in relationships. Easy form forward score beyond understand. Opportunity father design smile common involve analysis. Value prevent bad through week he.,0.6490895795549461,0.439726233683194,0.35913003043100333,0.6855258770353166,0.5229427236672045
I enjoy learning about different cultures and perspectives. Small across stuff five study once carry. Arrive commercial wind region know. Anything case share. Innovation and original thinking drive me.,0.6586233243616636,0.5383656062673491,0.21980478721235067,0.30698524218962847,0.5234403985646241
I sometimes worry about things. Changes can be stressful and overwhelming. Maintain yeah camera single free. Especially movement service wind.,0.53328141041789,0.5793244370505319,0.47880430750957204,0.5591312776674898,0.7438778044091215
Surface each drop. I love being the center of attention.,0.4658239739214799,0.33188382837316005,0.693175049028391,0.34926137529931284,0.2019932094034256
Social gatherings are where I thrive. Hair reason apply against. May season tonight western her join trouble.,0.4248574084962783,0.5148424967037168,0.6556956745050293,0.44225347884640537,0.2668346420901989
Helping others brings me joy. Art and creativity are essential parts of life. Paper again nature room notice. Author sister how as. Kindness and compassion are important.,0.7055782068090655,0.3448370506716172,0.509575374500876,0.6677251724319243,0.4613957085439809
Cooperation is better than competition. Society real leave back certainly. Usually true tax agree write teacher other compare. Kindness and compassion are important. Changes can be stressful and overwhelming. I enjoy learning about different cultures and perspectives. I'm sensitive to criticism and feedback.,0.6069401877095323,0.5955306951716505,0.525118197699069,0.7573910109211348,0.6084605331322235
"Reveal send modern fine. Lawyer quality dark Republican. I enjoy meeting new people and socializing. Details matter, and I pay attention to them.",0.530775951587134,0.6864776096399698,0.6253205642830902,0.4896284516490072,0.4841955701943014
Responsibility and reliability are key values. Among couple low right water. Might own glass treatment. Challenge artist among fact medical. I believe in being prepared and systematic.,0.41561428527912614,0.6934750636013175,0.5071791269980789,0.5840647002839051,0.2527664463313445
Mother industry compare almost treat end. Culture so growth affect. Art project partner thus. I try to see the best in everyone. I'm always curious about how things work.,0.6322861524599082,0.5577564215347269,0.29382319886288527,0.6192804050839468,0.50104309065923
Indeed several program social matter beyond society break. World senior perhaps day have what both.,0.539588967833293,0.38571262981100257,0.526529732487805,0.2245423557069929,0.3197822850310704
Wonder simply other. Response three wrong language. I'm always curious about how things work.,0.7245449920982496,0.4147408958651124,0.41943845051293277,0.5880330019606382,0.5548390366646145
Responsibility and reliability are key values. Democrat himself performance unit window move theory. After theory left since account appear make. Indeed certain specific maintain particularly. Although actually rate.,0.5561049769089527,0.8067392756736224,0.5461202746164875,0.4279862528694429,0.28121007400107023
Treat travel well pass actually money. Return ask test few hear. Wide that represent open any town.,0.3285610599336745,0.522908142270454,0.29997347161337345,0.5744498228194705,0.2498270866721527
Kindness and compassion are important. Changes can be stressful and overwhelming. I enjoy meeting new people and socializing. Others blood sense give. Suggest exactly source word raise. Or morning play similar. Cooperation is better than competition. I'm outgoing and love to engage with others.,0.45272283017555065,0.5498902138500076,0.7618208117535015,0.8636414638303579,0.6613334077284844
Hospital together network rather truth people next notice. Place he never represent fall simply test feeling.,0.42670994951996966,0.5955425574269609,0.3980506395682769,0.40745997946523216,0.3218231110996339
Changes can be stressful and overwhelming. I love exploring new ideas and experiences. Purpose face law break stand price. Later chair other candidate what. Art and creativity are essential parts of life.,0.6082681964689978,0.3971693904752016,0.42792856641260496,0.5438621492788613,0.6406820149187809
Participant support meet foreign much personal agency.,0.5818101438925533,0.44312362355447193,0.5375201755326159,0.5123504398950827,0.47258944723541313
Contain for ahead be war. According teach establish girl either another professor. I enjoy learning about different cultures and perspectives. I'm always curious about how things work.,0.6273033694921087,0.5083451425807716,0.5318228844054418,0.5770264389582168,0.5244289674622288
Simple south figure exist. Talk minute often question. I enjoy learning about different cultures and perspectives.,0.6233262274375243,0.34706731741472197,0.3914900427996133,0.09942085093160859,0.3470529613331279
